{"chunk":"c3","range":"L00059-L00090","topics":[{"id":"c3-T01","title":"가상문화센터 소강당 대관 (10월 24일)","status":"진행 중","certainty":"확정","conclusion":"소강당(수용 60명, 4시간 25만 원)이 10월 24일 가능한 것으로 확인되어 신청서를 제출 완료했고, 승인까지 2~3일 소요 예정이다. 장소 확정은 승인 결과에 달려 있어 아직 미완결이다.","evidence":[{"line":"L00060","quote":"가상문화센터 소강당 확인했습니다. 수용 인원 60명이고 10월 24일 가능합니다."},{"line":"L00061","quote":"대관료는 4시간 25만 원이라 오히려 더 저렴합니다."},{"line":"L00064","quote":"그럼 신청서 작성해서 제출해주세요."},{"line":"L00086","quote":"소강당 신청서 제출 완료했습니다. 승인은 2~3일 걸린다고 합니다."},{"line":"L00087","quote":"승인 나면 바로 알려주세요."}],"assumptions":[],"counter_evidence":[],"unknowns":["승인 결과가 실제로 났는지","승인 통보 시 공유 여부 — 이후 청크 확인 필요"],"owner":"담당자B","deadline":null,"next_check":"승인 결과(제출 후 2~3일) 통보 여부를 이후 청크에서 확인"},{"id":"c3-T02","title":"대관 신청용 동아리 등록증 사본 준비","status":"해결·결정","certainty":"확정","conclusion":"담당자C가 등록증 스캔본을 보냈고 담당자B가 수령을 확인해 필요 서류 준비가 완료되었다.","evidence":[{"line":"L00065","quote":"동아리 등록증 사본이 필요하다고 합니다. 혹시 가지고 계신 분?"},{"line":"L00066","quote":"제가 가지고 있어요. 스캔해서 보내드릴게요."},{"line":"L00068","quote":"등록증 스캔본 보냈습니다. 확인해주세요."},{"line":"L00069","quote":"잘 받았습니다."}],"assumptions":[],"counter_evidence":[],"unknowns":[],"owner":"담당자C","deadline":null,"next_check":"추가 서류 요구가 생기는지 이후 청크에서 확인"},{"id":"c3-T03","title":"강사 섭외 및 확정","status":"해결·결정","certainty":"확정","conclusion":"참여자D가 접촉한 강사가 10월 24일 가능하고 교통비만 받겠다고 하여 진행자A가 해당 강사로 확정했다. 참여자D가 강사에게 전달하겠다고 했으나 전달 완료 확인은 이 청크에 없다.","evidence":[{"line":"L00070","quote":"강사 건 말씀드립니다. 어제 연락드렸는데 10월 24일 가능하다고 하십니다."},{"line":"L00074","quote":"동아리 행사라 부담 갖지 말라고 하시면서 교통비만 주면 된다고 하셨어요."},{"line":"L00075","quote":"그럼 그분으로 확정하겠습니다."},{"line":"L00076","quote":"네 그렇게 전달드리겠습니다."}],"assumptions":[],"counter_evidence":[],"unknowns":["강사에게 확정 통보가 실제로 전달됐는지","교통비 금액·지급 방식 — 이후 청크 확인 필요"],"owner":"참여자D","deadline":null,"next_check":"강사 확정 전달 완료 보고 및 교통비 처리 논의를 이후 청크에서 확인"},{"id":"c3-T04","title":"강사 성함·소개 홍보물용 자료 전달","status":"담당 지정","certainty":"확정","conclusion":"진행자A가 참여자D에게 강사 성함과 소개를 담당자C에게 전달하도록 요청했고 참여자D가 오늘 중으로 정리해 주겠다고 했다. 이 청크 안에서 실제 전달 확인은 없다.","evidence":[{"line":"L00077","quote":"강사분 성함과 소개를 홍보물에 넣어야 하니 담당자C님께 전달 부탁드려요."},{"line":"L00078","quote":"네 오늘 중으로 정리해서 드릴게요."},{"line":"L00079","quote":"기다리고 있겠습니다."}],"assumptions":[],"counter_evidence":[],"unknowns":["전달 완료 여부 — 이후 청크 확인 필요"],"owner":"참여자D","deadline":"오늘 중(2026-10-07)","next_check":"담당자C가 강사 소개 자료를 받았는지 이후 청크에서 확인"},{"id":"c3-T05","title":"간식 준비 (50명 기준, 알레르기 대응)","status":"진행 중","certainty":"확정","conclusion":"음료와 빵 수준으로 하되 알레르기를 고려해 종류를 나누자는 의견이 나왔고, 알레르기 항목을 신청서에 넣는 것까지는 결정됐다. 간식 구매 품목·수량·담당자는 이 청크에서 정해지지 않았다.","evidence":[{"line":"L00080","quote":"간식은 어떻게 준비할까요? 50명 기준으로요."},{"line":"L00081","quote":"작년처럼 음료랑 빵 정도면 될 것 같은데요."},{"line":"L00082","quote":"알레르기 있는 분들을 위해 종류를 좀 나누는 게 좋겠어요."},{"line":"L00083","quote":"좋은 지적이네요. 신청서에 알레르기 항목을 넣읍시다."}],"assumptions":[],"counter_evidence":[],"unknowns":["간식 구매 담당자","예산과 구체 품목 — 이후 청크 확인 필요"],"owner":null,"deadline":null,"next_check":"간식 담당자·예산 결정 여부를 이후 청크에서 확인"},{"id":"c3-T06","title":"참가 신청 폼 제작","status":"해결·결정","certainty":"확정","conclusion":"진행자A가 직접 만들겠다고 한 뒤 같은 날 저녁 알레르기 항목을 포함해 신청 폼을 만들었고 참여자D가 확인했다.","evidence":[{"line":"L00084","quote":"신청 폼은 누가 만드나요?"},{"line":"L00085","quote":"제가 만들겠습니다. 오늘 중으로 링크 공유할게요."},{"line":"L00089","quote":"신청 폼 만들었습니다. 알레르기 항목 넣었어요."},{"line":"L00090","quote":"확인했습니다. 잘 만들어졌네요."}],"assumptions":[],"counter_evidence":[],"unknowns":["링크가 단톡방 외부(공지 등)에 실제 배포됐는지 — 이후 청크 확인 필요"],"owner":"진행자A","deadline":"오늘 중(2026-10-07)","next_check":"신청 폼 배포와 접수 현황을 이후 청크에서 확인"}],"summary":"10월 7일 구간으로, 행사(10월 24일) 준비가 여러 갈래로 진행됐다. 소강당 대관은 조건 확인 후 신청서 제출까지 끝났고 승인 대기 중(2~3일)이며, 필요 서류인 동아리 등록증 사본은 담당자C가 전달해 해결됐다. 강사는 10월 24일 가능·교통비만 수령 조건으로 진행자A가 확정했고, 홍보물용 강사 성함·소개 정리는 참여자D가 맡아 아직 전달 확인 전이다. 간식은 음료·빵에 알레르기 고려로 종류를 나누자는 방향만 정해졌고 담당자·예산은 미정이다. 신청 폼은 진행자A가 당일 알레르기 항목을 포함해 제작 완료했다. 이 청크는 전체의 일부이므로 미확인 항목들은 이후 청크에서 후속 확인이 필요하다."}
