{"chunk":"c2","range":"L00035-L00058","topics":[{"id":"c2-T01","title":"가상센터 대강당 예약 취소","status":"해결·결정","certainty":"확정","conclusion":"가상센터 내부 행사로 10월 24일 대강당 예약이 취소되었고, 보증금은 전액 환불된다고 전달됨. 진행자A가 취소를 수용함.","evidence":[{"line":"L00037","quote":"10월 24일에 내부 행사가 잡혀서 대강당 예약을 취소해야 한다고 합니다."},{"line":"L00039","quote":"보증금은 전액 환불해준다고 합니다."},{"line":"L00040","quote":"어쩔 수 없죠. 다른 장소를 다시 찾아야겠네요."}],"assumptions":[],"counter_evidence":[],"unknowns":["보증금 환불이 실제로 이행됐는지 이 구간에서는 확인되지 않음","이후 청크 확인 필요"],"owner":null,"deadline":null,"next_check":"보증금 전액 환불 처리 완료 여부"},{"id":"c2-T02","title":"대체 장소 물색","status":"담당 지정","certainty":"확정","conclusion":"진행자A가 장소 담당을 따로 지정하지 않고 본인이 직접 몇 군데 알아보기로 함. 별도로 담당자B가 가상문화센터 소강당을 알아보겠다고 했고(수용 인원 50명 조건), 이 구간에서 결과 보고는 없음.","evidence":[{"line":"L00041","quote":"장소 담당은 일단 다시 정하지 않겠습니다. 제가 직접 몇 군데 알아볼게요."},{"line":"L00049","quote":"가상문화센터 소강당이 있는데 거기도 알아볼까요?"},{"line":"L00050","quote":"수용 인원이 50명은 되어야 합니다"},{"line":"L00051","quote":"확인해보겠습니다."}],"assumptions":[],"counter_evidence":[],"unknowns":["소강당 수용 인원 및 예약 가능 여부","진행자A가 알아본 다른 후보지 결과","이후 청크 확인 필요"],"owner":"진행자A(직접 물색), 담당자B(가상문화센터 소강당 확인)","deadline":null,"next_check":"가상문화센터 소강당 확인 결과 및 대체 장소 확정 여부"},{"id":"c2-T03","title":"홍보물 시안 제작 (날짜·장소 칸 공란)","status":"담당 지정","certainty":"확정","conclusion":"진행자A가 날짜·장소 칸을 비워두고 제작하도록 결정했고, 담당자C가 시안을 예정대로 금요일에 제출하겠다고 함. 제출 이행은 이 구간에서 확인되지 않음.","evidence":[{"line":"L00042","quote":"그럼 홍보물 날짜는 일단 비워두고 만들까요?"},{"line":"L00043","quote":"네 날짜랑 장소 칸은 비워두세요. 확정되면 바로 채워넣죠."},{"line":"L00044","quote":"그럼 시안은 예정대로 금요일에 드릴게요."}],"assumptions":[],"counter_evidence":[],"unknowns":["금요일의 구체적 날짜는 원문에 명시되지 않음","시안 실제 제출 여부","이후 청크 확인 필요"],"owner":"담당자C","deadline":"금요일","next_check":"금요일 시안 제출 여부"},{"id":"c2-T04","title":"발표회 날짜 유지 및 입금 마감일","status":"해결·결정","certainty":"확정","conclusion":"참여자D의 날짜 변경 우려에 대해 진행자A가 날짜는 최대한 10월 24일을 유지하고 입금 마감(10월 17일)은 그대로 두기로 결정했고, 참여자D가 수용함.","evidence":[{"line":"L00045","quote":"장소 못 구하면 발표회 날짜도 바뀌는 건가요?"},{"line":"L00046","quote":"입금 마감을 이미 10월 17일로 공지했는데 괜찮을까요?"},{"line":"L00047","quote":"날짜는 최대한 24일 유지하려고 합니다. 입금 마감은 일단 그대로 두죠."},{"line":"L00048","quote":"네 알겠습니다."}],"assumptions":[],"counter_evidence":[{"line":"L00047","quote":"최대한 24일 유지하려고 합니다"}],"unknowns":["장소 확정 실패 시 날짜 재검토 여부","이후 청크 확인 필요"],"owner":null,"deadline":"입금 마감 10월 17일","next_check":"장소 확정 후 10월 24일 날짜 유지 확정 여부"},{"id":"c2-T05","title":"강사 섭외","status":"담당 지정","certainty":"확정","conclusion":"작년 강사는 10월 24일 선약으로 불가. 참여자D가 아는 분께 문의하기로 하고 오늘 저녁 연락 후 내일 알려주겠다고 함. 결과는 이 구간에 없음. 주제는 작년과 비슷한 방향 요청.","evidence":[{"line":"L00052","quote":"작년 강사분께 연락드렸는데 10월 24일은 선약이 있으시다고 하네요."},{"line":"L00053","quote":"그럼 제가 아는 분께 여쭤볼까요?"},{"line":"L00054","quote":"네 부탁드립니다. 주제는 작년과 비슷하면 좋겠어요."},{"line":"L00055","quote":"오늘 저녁에 연락드려보고 내일 알려드리겠습니다."}],"assumptions":[],"counter_evidence":[],"unknowns":["후보 강사의 수락 여부","이후 청크 확인 필요"],"owner":"참여자D","deadline":"내일(10월 7일) 공유","next_check":"10월 7일 참여자D의 강사 섭외 결과 보고"},{"id":"c2-T06","title":"인쇄소 할인 기한 확인","status":"정보공유","certainty":"확정","conclusion":"담당자C가 인쇄소 할인이 이번 달 말까지임을 재확인했고 시간 여유가 있다는 의견을 공유함. 별도 결정 요청이나 응답은 없음.","evidence":[{"line":"L00056","quote":"인쇄소 할인이 이번 달 말까지라고 다시 확인했습니다."},{"line":"L00057","quote":"시간 여유는 있으니 천천히 해도 될 것 같아요."}],"assumptions":[],"counter_evidence":[],"unknowns":["인쇄 발주 시점에 대한 결정 여부","이후 청크 확인 필요"],"owner":null,"deadline":"이번 달 말(할인 적용 기한)","next_check":"10월 말 이전 인쇄 발주 일정 논의 여부"}],"summary":"10월 6일 하루 구간으로, 전날 확정됐던 10월 24일 대강당 예약이 취소되면서 장소 안건이 원점으로 돌아갔습니다(L00037). 진행자A가 직접 대체 장소를 알아보기로 하고 담당자B가 가상문화센터 소강당(50명 수용 조건)을 확인하기로 했으나 결과 보고는 없습니다. 홍보물은 날짜·장소 칸을 비운 채 담당자C가 금요일 시안 제출 예정이고, 발표회 날짜 10월 24일과 입금 마감 10월 17일은 일단 유지로 결정됐습니다. 작년 강사는 선약으로 불가해 참여자D가 대체 강사를 알아보고 내일 공유하기로 했습니다. 인쇄소 할인 기한(이번 달 말)은 정보공유 성격입니다. 미이행 항목들은 청크 밖에서 처리됐을 수 있어 흐지부지로 단정하지 않고 담당 지정 상태로 두었습니다."}
