{"chunk":"c1","range":"L00001-L00034","topics":[{"id":"c1-T01","title":"발표회 장소(가상센터 대강당) 확정 및 예약","status":"해결·결정","certainty":"확정","conclusion":"담당자B가 가상센터에 문의해 10월 24일 토요일만 가능함을 확인했고, 진행자A가 10월 24일로 확정. 대관료 4시간 30만 원(보증금 10만 원 행사 후 환불)이 예산 내로 판단되어 예약 지시가 내려졌고, 담당자B가 오전 11:20 예약 완료 및 예약번호 확보를 보고함. 결정과 이행이 모두 대화에서 확인됨.","evidence":[{"line":"L00007","quote":"장소는 제가 알아볼게요. 가상센터 대강당이 제일 무난할 것 같습니다."},{"line":"L00017","quote":"가상센터 전화했는데 대강당은 10월 24일 토요일만 비어 있다고 합니다."},{"line":"L00018","quote":"그럼 10월 24일로 확정합시다."},{"line":"L00019","quote":"4시간에 30만 원이고, 보증금 10만 원은 행사 후 환불이라고 하네요."},{"line":"L00020","quote":"예산 안에 들어오네요. 예약 진행해주세요."},{"line":"L00022","quote":"대강당 예약 완료했습니다. 예약번호 받아뒀어요."}],"assumptions":[],"counter_evidence":[],"unknowns":["예약금·대관료 실제 납부 여부는 언급 없음","예약번호 값 자체는 대화에 기재되지 않음","이후 청크 확인 필요"],"owner":"담당자B","deadline":null,"next_check":"이후 청크에서 대관료 납부, 예약 변경·취소 언급이 있는지 확인"},{"id":"c1-T02","title":"홍보물(포스터) 시안 제작","status":"담당 지정","certainty":"확정","conclusion":"담당자C가 홍보물을 맡겠다고 자원하고 진행자A가 수락했으며, 담당자C가 이번 주 금요일까지 시안 두 개를 만들겠다고 본인이 기한을 밝힘. 문구는 작년 것을 유지하되 날짜·장소만 변경하기로 결정됨. 청크 마지막(10월 5일 오후 5시) 시점까지 시안 제출·진행 상황 보고는 확인되지 않음.","evidence":[{"line":"L00010","quote":"홍보물은 제가 맡을까요? 예전에 포스터 만들어본 적 있어요."},{"line":"L00011","quote":"부탁드려요. 초안은 언제쯤 볼 수 있을까요?"},{"line":"L00012","quote":"이번 주 금요일까지 시안 두 개 만들어오겠습니다."},{"line":"L00028","quote":"홍보물에 들어갈 문구는 작년 그대로 써도 될까요?"},{"line":"L00029","quote":"날짜랑 장소만 바꾸고 나머지는 그대로 가죠."}],"assumptions":[],"counter_evidence":[],"unknowns":["\"이번 주 금요일\"에 해당하는 구체적 날짜는 대화에 명시되지 않음","시안 실제 제출 여부 미확인","이후 청크 확인 필요"],"owner":"담당자C","deadline":"이번 주 금요일","next_check":"이후 청크에서 시안 두 개 공유 여부 및 진행자A 피드백 확인"},{"id":"c1-T03","title":"참가비 금액 및 입금 마감일","status":"해결·결정","certainty":"확정","conclusion":"참여자D의 질문에 진행자A가 참가비를 작년 5천 원에서 1만 원으로 인상하기로 결정. 입금 마감은 발표회 일주일 전으로 하되 장소 확정 후 정하기로 했고, 장소가 10월 24일로 확정된 뒤 진행자A가 10월 17일 금요일로 확정함. 결정만 확인되며 공지·수납 등 이행은 확인되지 않음.","evidence":[{"line":"L00013","quote":"참가비는 얼마로 할까요? 작년에 5천 원이었는데요."},{"line":"L00014","quote":"올해는 1만 원으로 올립시다. 간식비가 많이 올랐어요."},{"line":"L00016","quote":"발표회 일주일 전까지로 하죠. 정확한 날짜는 장소 확정되면 정합시다."},{"line":"L00023","quote":"그럼 입금 마감은 10월 17일 금요일로 하겠습니다."}],"assumptions":[],"counter_evidence":[],"unknowns":["참가비 인상 공지 주체·방법 미언급","입금 계좌 및 수납 담당자 미언급","이후 청크 확인 필요"],"owner":null,"deadline":"10월 17일 금요일","next_check":"이후 청크에서 참가비 공지, 입금 현황, 마감일 변경 언급 확인"},{"id":"c1-T04","title":"외부 강사 섭외","status":"담당 지정","certainty":"확정","conclusion":"진행자A가 작년에 온 강사에게 먼저 문의해 보겠다는 의향을 밝히고, 참여자D의 지인 소개 제안에 대해 \"안 되면 부탁드릴게요\"로 보류 처리함. 청크 마지막 시점까지 실제 연락 여부나 결과는 확인되지 않음.","evidence":[{"line":"L00024","quote":"외부 강사는 누구 생각하고 계세요?"},{"line":"L00025","quote":"작년에 오셨던 분께 다시 여쭤볼까 하는데, 일정이 될지 모르겠네요."},{"line":"L00026","quote":"제가 아는 분 중에도 괜찮은 분 계신데 연락처 드릴까요?"},{"line":"L00027","quote":"일단 작년 분께 먼저 여쭤보고 안 되면 부탁드릴게요."}],"assumptions":[],"counter_evidence":[],"unknowns":["강사 후보 이름·연락 시점 미언급","연락 기한 미언급","이후 청크 확인 필요"],"owner":"진행자A","deadline":null,"next_check":"이후 청크에서 작년 강사 회신 결과 및 참여자D 지인 연락처 전달 여부 확인"},{"id":"c1-T05","title":"학교 앞 인쇄소 할인 행사 정보 및 인쇄 발주","status":"담당 지정","certainty":"확정","conclusion":"참여자D가 학교 앞 인쇄소의 100장 이상 30% 할인 정보를 공유했고, 담당자C가 시안이 나오면 그곳에 맡겨보겠다고 응답함. 정보 공유에 그치지 않고 담당자C의 수행 의사 표명까지 확인되나, 발주 이행은 확인되지 않음.","evidence":[{"line":"L00031","quote":"학교 앞 인쇄소가 이번 달에 할인 행사 한다고 합니다."},{"line":"L00032","quote":"100장 이상이면 30퍼센트 할인이래요."},{"line":"L00033","quote":"오 그거 좋네요. 시안 나오면 거기 맡겨보겠습니다."}],"assumptions":[],"counter_evidence":[],"unknowns":["인쇄 수량·비용·예산 승인 여부 미언급","할인 행사 종료일 미언급","이후 청크 확인 필요"],"owner":"담당자C","deadline":null,"next_check":"이후 청크에서 인쇄 발주 진행 및 비용 승인 언급 확인"}],"summary":"10월 5일 하루치 대화(L00001~L00034)에서 진행자A가 제시한 4개 안건(장소·홍보물·참가비·외부강사)과 파생 안건 1개(인쇄소 할인)를 확인했습니다. 장소는 10월 24일 가상센터 대강당으로 확정되고 담당자B의 예약 완료 보고까지 이행이 확인되었습니다. 참가비는 1만 원, 입금 마감 10월 17일 금요일로 결정되었으나 공지·수납 이행은 미확인입니다. 홍보물 시안(담당자C, 이번 주 금요일)과 인쇄소 발주(담당자C), 외부 강사 섭외(진행자A)는 담당자만 지정된 상태로 청크가 끝납니다. 모든 미이행 안건은 이후 청크에서 해결되었을 수 있어 흐지부지로 단정하지 않았습니다."}
