{"chunk":"c4","range":"L00091-L00132","topics":[{"id":"c4-T01","title":"홍보물 시안 선택","status":"해결·결정","certainty":"확정","conclusion":"두 개 시안 중 첫 번째 시안으로 확정. 진행자A·참여자D·담당자B 모두 첫 번째를 선택했고 담당자C가 첫 번째로 진행한다고 밝힘.","evidence":[{"line":"L00092","quote":"홍보물 시안 두 개 만들었습니다. 의견 부탁드려요."},{"line":"L00093","quote":"첫 번째가 깔끔하고 좋네요. 두 번째는 글씨가 좀 작은 것 같아요."},{"line":"L00094","quote":"저도 첫 번째에 한 표입니다."},{"line":"L00095","quote":"첫 번째가 나아 보입니다."},{"line":"L00096","quote":"그럼 첫 번째로 진행하겠습니다."}],"assumptions":[],"counter_evidence":[],"unknowns":[],"owner":"담당자C","deadline":null,"next_check":"인쇄물 수령 후 선택된 시안대로 나왔는지 확인"},{"id":"c4-T02","title":"소강당 대관 승인 및 일시 확정","status":"해결·결정","certainty":"확정","conclusion":"10월 8일 시점 미승인 상태였으나 10월 9일 오전 승인 확정. 10월 24일 오후 1시~5시로 확정.","evidence":[{"line":"L00104","quote":"소강당 승인 아직 안 났습니다. 내일쯤 나올 것 같아요."},{"line":"L00109","quote":"소강당 승인 났습니다. 10월 24일 오후 1시부터 5시까지 확정입니다."},{"line":"L00110","quote":"드디어 확정됐네요. 수고 많으셨습니다."}],"assumptions":[],"counter_evidence":[],"unknowns":[],"owner":"담당자B","deadline":null,"next_check":"행사 전 대관 조건(시간·장비) 재확인"},{"id":"c4-T03","title":"홍보물 인쇄 발주(수량·일정)","status":"해결·결정","certainty":"확정","conclusion":"장소·시간 반영 후 100장 주문 완료. 다음 주 화요일 출고 예정이라는 이행 보고까지 확인됨.","evidence":[{"line":"L00111","quote":"그럼 홍보물에 장소랑 시간 넣고 인쇄 맡기겠습니다."},{"line":"L00113","quote":"할인 받으려면 100장 이상이어야 하니 100장으로 하겠습니다."},{"line":"L00120","quote":"인쇄소에 100장 주문했습니다. 다음 주 화요일에 나온다고 합니다."}],"assumptions":[],"counter_evidence":[],"unknowns":["실제 수령 여부는 다음 주 화요일 이후 확인 필요","이후 청크 확인 필요"],"owner":"담당자C","deadline":null,"next_check":"다음 주 화요일 인쇄물 수령 여부 확인"},{"id":"c4-T04","title":"강사 소개 자료 전달 및 홍보물 반영","status":"해결·결정","certainty":"확정","conclusion":"참여자D가 강사 소개를 담당자C에게 전달했고 담당자C가 수령 확인. 반영하겠다고 답했으나 실제 반영 확인 발언은 이 구간에 없음.","evidence":[{"line":"L00098","quote":"강사분 소개 정리해서 담당자C님께 보냈습니다."},{"line":"L00099","quote":"받았습니다. 반영하겠습니다."}],"assumptions":[],"counter_evidence":[],"unknowns":["반영 완료 여부 미확인","이후 청크 확인 필요"],"owner":"담당자C","deadline":null,"next_check":"인쇄본에 강사 소개 반영됐는지 확인"},{"id":"c4-T05","title":"발표 순서 결정 시점","status":"해결·결정","certainty":"확정","conclusion":"발표 순서는 신청을 받은 뒤에 정하기로 합의. 순서 자체는 아직 미정.","evidence":[{"line":"L00100","quote":"발표 순서도 정해야 하는데 신청 받고 나서 정할까요?"},{"line":"L00101","quote":"네 그게 나을 것 같습니다."}],"assumptions":[],"counter_evidence":[],"unknowns":["실제 발표 순서 확정 시점 미정","이후 청크 확인 필요"],"owner":null,"deadline":null,"next_check":"신청 마감 후 발표 순서 결정 진행 여부"},{"id":"c4-T06","title":"뒤풀이 장소 예약","status":"해결·결정","certainty":"확정","conclusion":"미리 예약하자는 제안에 대해 인원 확정 후 알아보기로 결정. 예약 행위는 보류 상태.","evidence":[{"line":"L00102","quote":"뒤풀이 장소도 미리 예약해둘까요?"},{"line":"L00103","quote":"인원이 확정되면 그때 알아봅시다."}],"assumptions":[],"counter_evidence":[],"unknowns":["인원 확정 기준 시점 미명시","이후 청크 확인 필요"],"owner":null,"deadline":null,"next_check":"참가 인원 확정 후 뒤풀이 장소 논의 재개 여부"},{"id":"c4-T07","title":"입금 마감일 확인 및 공지","status":"담당 지정","certainty":"확정","conclusion":"입금 마감은 10월 17일 금요일로 유지 확정. 참여자D가 공지하겠다고 했으나 공지 완료 보고는 이 구간에 없음.","evidence":[{"line":"L00115","quote":"장소가 확정됐으니 입금 마감도 다시 확인합시다. 10월 17일 금요일 그대로 갑니다."},{"line":"L00116","quote":"네 공지하겠습니다."}],"assumptions":[],"counter_evidence":[],"unknowns":["공지 이행 여부 미확인","이후 청크 확인 필요"],"owner":"참여자D","deadline":"10월 17일 금요일(입금 마감)","next_check":"입금 마감 공지 발송 여부 확인"},{"id":"c4-T08","title":"참가비 1만 원 유지 여부","status":"해결·결정","certainty":"확정","conclusion":"작년 대비 두 배라는 우려가 제기됐으나 간식·자료집 비용을 이유로 1만 원 유지로 결정, 참여자D도 수용.","evidence":[{"line":"L00117","quote":"그런데 참가비 1만 원은 확정인가요? 작년보다 두 배라 문의가 있을 것 같아서요."},{"line":"L00118","quote":"간식이랑 자료집 생각하면 1만 원도 빠듯합니다. 그대로 가죠."},{"line":"L00119","quote":"알겠습니다."}],"assumptions":[],"counter_evidence":[],"unknowns":[],"owner":null,"deadline":null,"next_check":"참가비 문의 발생 시 대응 방침 필요 여부"},{"id":"c4-T09","title":"대관료 25만 원 입금","status":"담당 지정","certainty":"확정","conclusion":"진행자A가 10월 21일에 25만 원을 입금하겠다고 밝혔고 담당자B가 기한(행사 3일 전)을 확인. 입금 이행은 미확인.","evidence":[{"line":"L00122","quote":"대관료 25만 원은 언제 입금하면 될까요?"},{"line":"L00123","quote":"행사 3일 전까지라고 하셨죠? 제가 10월 21일에 입금하겠습니다."},{"line":"L00124","quote":"네 맞습니다."}],"assumptions":[],"counter_evidence":[],"unknowns":["입금 실행 여부 미확인","이후 청크 확인 필요"],"owner":"진행자A","deadline":"10월 21일","next_check":"10월 21일 대관료 입금 완료 여부 확인"},{"id":"c4-T10","title":"신청 접수 현황 및 정원","status":"정보공유","certainty":"확정","conclusion":"신청 폼 오픈 후 12명 접수됐다는 공유. 정원 50명까지 가능하므로 계속 홍보하기로 함.","evidence":[{"line":"L00125","quote":"신청 폼 열어두었더니 벌써 12명 신청했습니다."},{"line":"L00126","quote":"좋네요. 50명까지 받을 수 있으니 계속 홍보합시다."}],"assumptions":[],"counter_evidence":[],"unknowns":["이후 청크 확인 필요"],"owner":null,"deadline":null,"next_check":"다음 주 신청 인원 추이 확인"},{"id":"c4-T11","title":"포스터 게시(게시판·강의실)","status":"담당 지정","certainty":"확정","conclusion":"담당자C가 포스터 출고 후 게시판과 강의실에 부착하겠다고 밝힘. 부착 이행은 인쇄물 수령 이후 사안.","evidence":[{"line":"L00127","quote":"포스터 나오면 게시판이랑 강의실에 붙이겠습니다."},{"line":"L00128","quote":"네 부탁드려요."}],"assumptions":[],"counter_evidence":[],"unknowns":["부착 이행 여부 미확인","이후 청크 확인 필요"],"owner":"담당자C","deadline":null,"next_check":"인쇄물 수령 후 게시 완료 여부 확인"},{"id":"c4-T12","title":"행사 사진 촬영 담당자 지정","status":"진행 중","certainty":"확정","conclusion":"10월 8일 최초 질문에 답이 없었고, 10월 9일 재질문에 담당자C가 발표 때문에 어렵다고 함. 진행자A가 신청자 중에 부탁해보자는 방향만 제시했고 담당자는 미정 상태로 주간 마무리.","evidence":[{"line":"L00106","quote":"혹시 행사 사진 찍을 분은 정하셨나요?"},{"line":"L00129","quote":"사진 찍을 분은 아직 안 정해졌죠?"},{"line":"L00130","quote":"제가 카메라는 있는데 발표도 해야 해서 어려울 것 같아요."},{"line":"L00131","quote":"그럼 신청자 중에 부탁해보는 것도 방법이겠네요."}],"assumptions":[],"counter_evidence":[{"line":"L00107","quote":"오늘은 여기까지 하겠습니다."}],"unknowns":["신청자에게 부탁하는 안을 누가 실행할지 미지정","이후 청크 확인 필요"],"owner":null,"deadline":null,"next_check":"다음 주 촬영 담당자 확정 여부 확인"}],"summary":"10월 8~9일 구간에서 소강당 대관이 10월 24일 오후 1~5시로 최종 승인되며 홍보물 시안(1안), 인쇄 100장 발주, 입금 마감 10월 17일 유지, 참가비 1만 원 유지, 대관료 25만 원 10월 21일 입금 등 주요 사항이 연달아 확정됐습니다. 이행 확인이 남은 항목은 입금 마감 공지(참여자D), 대관료 입금(진행자A), 포스터 부착(담당자C), 강사 소개 반영(담당자C)입니다. 발표 순서와 뒤풀이 장소는 각각 신청 마감·인원 확정 이후로 미루기로 합의됐고, 행사 사진 촬영 담당자는 두 차례 제기됐으나 담당자C가 고사하여 미정 상태로 주간이 종료됐습니다. 이 청크는 전체 대화의 마지막 구간이나 청크 외부 확인이 필요한 이행 항목은 unknowns에 표기했습니다."}
